{
  "$schema": "../../asset-metadata.schema.json",
  "name": "Whatsapp-wrap",
  "tags": [
    "Whatsapp-wrap",
    "业务图标"
  ],
  "use-cases": [
    "Whatsapp-wrap相关入口或状态展示"
  ],
  "i18n": {
    "en": {
      "name": "Whatsapp-wrap",
      "tags": [
        "Whatsapp-wrap",
        "business icon"
      ],
      "use-cases": [
        "Whatsapp-wrap entry or status"
      ]
    }
  }
}
