{
  "$schema": "../../asset-metadata.schema.json",
  "name": "客服坐席权限填充",
  "tags": ["客服坐席权限填充", "客服坐席", "权限", "填充", "填充业务图标", "业务图标"],
  "use-cases": ["客服坐席权限填充相关入口或状态展示", "需要兼容历史业务视觉的客服坐席权限填充场景"],
  "i18n": {
    "en": {
      "name": "agent permission filled",
      "tags": [
        "agent permission filled",
        "agent",
        "permission",
        "filled",
        "filled business icon",
        "business icon"
      ],
      "use-cases": [
        "agent permission filled entry or status",
        "Legacy business visual for agent permission filled scenarios"
      ]
    }
  }
}
