{
  "$schema": "../../asset-metadata.schema.json",
  "name": "更多sender",
  "tags": ["更多sender", "更多", "sender", "描边业务图标", "业务图标"],
  "use-cases": ["更多sender相关入口或状态展示", "需要兼容历史业务视觉的更多sender场景"],
  "i18n": {
    "en": {
      "name": "more sender",
      "tags": ["more sender", "more", "sender", "outlined business icon", "business icon"],
      "use-cases": [
        "more sender entry or status",
        "Legacy business visual for more sender scenarios"
      ]
    }
  }
}
