{
  "$schema": "../asset-metadata.schema.json",
  "name": "营销自动化",
  "tags": ["营销自动化", "流程", "自动化", "触达"],
  "use-cases": ["营销自动化流程展示", "自动化触达或任务编排场景"],
  "i18n": {
    "en": {
      "name": "Marketing Automation",
      "tags": ["marketing automation", "workflow", "automation", "outreach"],
      "use-cases": [
        "Marketing automation workflow display",
        "Automated outreach or task orchestration scenarios"
      ]
    }
  }
}
