{
  "$schema": "../../asset-metadata.schema.json",
  "name": "creditcard图标",
  "tags": ["creditcard图标", "credit", "card", "图标", "描边业务图标", "业务图标"],
  "use-cases": ["creditcard图标相关入口或状态展示", "需要兼容历史业务视觉的creditcard图标场景"],
  "i18n": {
    "en": {
      "name": "credit card icon",
      "tags": [
        "credit card icon",
        "credit",
        "card",
        "icon",
        "outlined business icon",
        "business icon"
      ],
      "use-cases": [
        "credit card icon entry or status",
        "Legacy business visual for credit card icon scenarios"
      ]
    }
  }
}
