{
  "$schema": "../../asset-metadata.schema.json",
  "name": "通话in",
  "tags": ["通话in", "通话", "in", "描边业务图标", "业务图标"],
  "use-cases": ["通话in相关入口或状态展示", "需要兼容历史业务视觉的通话in场景"],
  "i18n": {
    "en": {
      "name": "call in",
      "tags": ["call in", "call", "in", "outlined business icon", "business icon"],
      "use-cases": ["call in entry or status", "Legacy business visual for call in scenarios"]
    }
  }
}
