{
  "$schema": "../../asset-metadata.schema.json",
  "name": "Calling-wrap",
  "tags": ["Calling-wrap", "业务图标"],
  "use-cases": ["Calling-wrap相关入口或状态展示"],
  "i18n": {
    "en": {
      "name": "Calling-wrap",
      "tags": ["Calling-wrap", "business icon"],
      "use-cases": ["Calling-wrap entry or status"]
    }
  },
  "aliases": [
    {
      "name": "Calling-wrap"
    }
  ]
}
