{
  "$schema": "../../asset-metadata.schema.json",
  "name": "Home",
  "tags": ["Home", "业务图标"],
  "use-cases": ["Home相关入口或状态展示"],
  "i18n": {
    "en": {
      "name": "Home",
      "tags": ["Home", "business icon"],
      "use-cases": ["Home entry or status"]
    }
  },
  "aliases": [
    {
      "name": "Home-wrap"
    }
  ]
}
