{
  "$schema": "../../asset-metadata.schema.json",
  "name": "benefit模板",
  "tags": ["benefit模板", "benefit", "模板", "描边业务图标", "业务图标"],
  "use-cases": ["benefit模板相关入口或状态展示", "需要兼容历史业务视觉的benefit模板场景"],
  "i18n": {
    "en": {
      "name": "benefit template",
      "tags": [
        "benefit template",
        "benefit",
        "template",
        "outlined business icon",
        "business icon"
      ],
      "use-cases": [
        "benefit template entry or status",
        "Legacy business visual for benefit template scenarios"
      ]
    }
  }
}
