{
  "$schema": "../../asset-metadata.schema.json",
  "name": "benefitsimple",
  "tags": ["简单易用", "号码验证", "集成卖点", "快速接入", "填充", "业务图标"],
  "use-cases": ["用于号码验证集成上手页展示易用性", "说明号码验证服务的快速接入体验"],
  "i18n": {
    "en": {
      "name": "benefit simple",
      "tags": [
        "simplicity benefit",
        "number verification",
        "integration benefit",
        "quick setup",
        "filled",
        "business icon"
      ],
      "use-cases": [
        "Show ease of use on number verification onboarding",
        "Explain the quick setup experience for number verification"
      ]
    }
  },
  "aliases": ["benefit-simple", "benefit-simple_filled"]
}
