{
  "$schema": "../../asset-metadata.schema.json",
  "name": "账单填充",
  "tags": ["账单填充", "账单", "填充", "填充业务图标", "业务图标"],
  "use-cases": ["账单填充相关入口或状态展示", "需要兼容历史业务视觉的账单填充场景"],
  "i18n": {
    "en": {
      "name": "billing filled",
      "tags": ["billing filled", "billing", "filled", "filled business icon", "business icon"],
      "use-cases": [
        "billing filled entry or status",
        "Legacy business visual for billing filled scenarios"
      ]
    }
  }
}
