{
  "$schema": "../asset-metadata.schema.json",
  "name": "自定义图标",
  "tags": ["自定义", "代码", "图标", "配置"],
  "use-cases": ["自定义图标配置入口", "开发者自定义能力展示"],
  "i18n": {
    "en": {
      "name": "Custom Icon",
      "tags": ["custom", "code", "icon", "configuration"],
      "use-cases": ["Custom icon configuration entry", "Developer customization capability display"]
    }
  }
}
