{
  "$schema": "../../asset-metadata.schema.json",
  "name": "ProductDocs",
  "tags": ["ProductDocs", "业务图标"],
  "use-cases": ["ProductDocs相关入口或状态展示"],
  "i18n": {
    "en": {
      "name": "ProductDocs",
      "tags": ["ProductDocs", "business icon"],
      "use-cases": ["ProductDocs entry or status"]
    }
  },
  "aliases": [
    {
      "name": "ProductDocs"
    }
  ]
}
