{
  "$schema": "../../asset-metadata.schema.json",
  "name": "关闭 Logo",
  "tags": ["关闭", "标识", "品牌", "状态"],
  "use-cases": ["关闭入口或品牌状态展示", "品牌标识关闭态插画"],
  "i18n": {
    "en": {
      "name": "Close Logo",
      "tags": ["close", "logo", "brand", "status"],
      "use-cases": ["Closing entry or brand state display", "Brand mark close-state illustration"]
    }
  }
}
